"seqword_main_id","genus","species","strain","description","lineage","lineage","lineage","sequence","sequence_length","locus_length","left_border","fk_accessions_id"
685,"Prochlorococcus","marinus","MIT9312","Prochlorococcus marinus MIT9312 chromosome I, NC_007577","Cyanobacteria","Cyanobacteria",1,1709204,1709204,0,685,
684,"Prochlorococcus","marinus","MIT 9515","Prochlorococcus marinus MIT 9515 chromosome I, NC_008817","Cyanobacteria","Cyanobacteria",1,1704176,1704176,0,684,
1311,"Leuconostoc","citreum","KM20","Leuconostoc citreum KM20 chromosome I, NC_010471","Cyanobacteria","Cyanobacteria",1,1796284,1796284,0,1332,
1569,"Cyanothece","sp.","PCC 7425","Cyanothece sp. PCC 7425 chromosome I, NC_011884","Cyanobacteria","Cyanobacteria",1,5374574,5374574,0,1584,
687,"Prochlorococcus","marinus","NATL1A","Prochlorococcus marinus NATL1A chromosome I, NC_008819","Cyanobacteria","Cyanobacteria",1,1864731,1864731,0,687,
1573,"Cyanothece","sp.","PCC 8801","Cyanothece sp. PCC 8801 chromosome I, NC_011726","Cyanobacteria","Cyanobacteria",1,4679413,4679413,0,1588,
385,"Gloeobacter","violaceus","PCC7421","Gloeobacter violaceus PCC7421 chromosome I, NC_005125","Cyanobacteria","Cyanobacteria",1,4659019,4659019,0,385,
688,"Prochlorococcus","marinus","NATL2A","Prochlorococcus marinus NATL2A chromosome I, NC_007335","Cyanobacteria","Cyanobacteria",1,1842899,1842899,0,688,
949,"Synechococcus","elongatus","PCC 7942","Synechococcus elongatus PCC 7942 chromosome I, NC_007604","Cyanobacteria","Cyanobacteria",1,2695903,2695903,0,949,
956,"Synechococcus","sp.","JA-3-3Ab","Synechococcus sp. JA-3-3Ab chromosome I, NC_007775","Cyanobacteria","Cyanobacteria",1,2932766,2932766,0,956,
689,"Prochlorococcus","marinus","ssp pastoris CCMP1986-MED4","Prochlorococcus marinus ssp pastoris CCMP1986-MED4 chromosome I, NC_005072","Cyanobacteria","Cyanobacteria",1,1657990,1657990,0,689,
686,"Prochlorococcus","marinus","MIT9313","Prochlorococcus marinus MIT9313 chromosome I, NC_005071","Cyanobacteria","Cyanobacteria",1,2410873,2410873,0,686,
682,"Prochlorococcus","marinus","MIT 9301","Prochlorococcus marinus MIT 9301 chromosome I, NC_009091","Cyanobacteria","Cyanobacteria",1,1641879,1641879,0,682,
683,"Prochlorococcus","marinus","MIT 9303","Prochlorococcus marinus MIT 9303 chromosome I, NC_008820","Cyanobacteria","Cyanobacteria",1,2682675,2682675,0,683,
958,"Synechocystis","sp","PCC6803","Synechocystis sp PCC6803 chromosome I, NC_000911","Cyanobacteria","Cyanobacteria",1,3573470,3573470,0,958,
954,"Synechococcus","sp.","CC9311","Synechococcus sp. CC9311 chromosome I, NC_008319","Cyanobacteria","Cyanobacteria",1,2606748,2606748,0,954,
679,"Prochlorococcus","marinus","AS9601","Prochlorococcus marinus AS9601 chromosome I, NC_008816","Cyanobacteria","Cyanobacteria",1,1669886,1669886,0,679,
680,"Prochlorococcus","marinus","CCMP1375","Prochlorococcus marinus CCMP1375 chromosome I, NC_005042","Cyanobacteria","Cyanobacteria",1,1751080,1751080,0,680,
974,"Thermosynechococcus","elongatus","BP-1","Thermosynechococcus elongatus BP-1 chromosome I, NC_004113","Cyanobacteria","Cyanobacteria",1,2593857,2593857,0,974,
952,"Synechococcus","sp","CC9902","Synechococcus sp CC9902 chromosome I, NC_007513","Cyanobacteria","Cyanobacteria",1,2234828,2234828,0,952,
40,"Anabaena","variabilis","ATCC29413","Anabaena variabilis ATCC29413 chromosome I, NC_007413","Cyanobacteria","Cyanobacteria",1,6365727,6365727,0,40,
955,"Synechococcus","sp.","JA-2-3B'a(2-13)","Synechococcus sp. JA-2-3B'a(2-13) chromosome I, NC_007776","Cyanobacteria","Cyanobacteria",1,3046682,3046682,0,955,
1189,"Prochlorococcus","marinus","MIT 9211","Prochlorococcus marinus MIT 9211 chromosome I, NC_009976","Cyanobacteria","Cyanobacteria",1,1688878,1688878,0,1221,
1232,"Microcystis","aeruginosa","NIES-843","Microcystis aeruginosa NIES-843 chromosome I, NC_010296","Cyanobacteria","Cyanobacteria",1,5842795,5842795,0,1264,
1281,"Cyanothece","sp.","ATCC","Cyanothece sp. ATCC 51142 chromosome, I$NC_010546.txt","Cyanobacteria","Cyanobacteria",1,4934271,4934271,0,1304,
1451,"Prochlorococcus","marinus","MIT 9215","Prochlorococcus marinus MIT 9215 chromosome I, NC_009840","Cyanobacteria","Cyanobacteria",1,1738790,1738790,0,1466,
951,"Synechococcus","sp","CC9605","Synechococcus sp CC9605 chromosome I, NC_007516","Cyanobacteria","Cyanobacteria",1,2510659,2510659,0,951,
953,"Synechococcus","sp","WH8102","Synechococcus sp WH8102 chromosome I, NC_005070","Cyanobacteria","Cyanobacteria",1,2434428,2434428,0,953,
1393,"Nostoc","punctiforme","PCC 73102 ATCC 29133","Nostoc punctiforme PCC 73102 ATCC 29133 chromosome I, NC_010628","Cyanobacteria","Cyanobacteria",1,8234322,8234322,0,1408,
981,"Thermus","thermophilus","HB8","Thermus thermophilus HB8 chromosome I, NC_006461","Deinococcus/Thermus","Deinococcus/Thermus",1,1849742,1849742,0,981,
298,"Deinococcus","geothermalis","DSM11300","Deinococcus geothermalis DSM11300 chromosome I, NC_008025","Deinococcus/Thermus","Deinococcus/Thermus",1,2467205,2467205,0,298,
2541,"Deinococcus","deserti","VCD115","Deinococcus deserti VCD115 chromosome I, NC_012526","Deinococcus/Thermus","Deinococcus/Thermus",1,2819842,2819842,0,2556,
299,"Deinococcus","radiodurans","R1","Deinococcus radiodurans R1 chromosome I, NC_001263","Deinococcus/Thermus","Deinococcus/Thermus",1,2648638,2648638,0,299,
979,"Thermus","thermophilus","HB27","Thermus thermophilus HB27 chromosome I, NC_005835","Deinococcus/Thermus","Deinococcus/Thermus",1,1894877,1894877,0,979,
1577,"Desulfatibacillum","alkenivorans","AK-01","Desulfatibacillum alkenivorans AK-01 chromosome I, NC_011768","Deltaproteobacteria","Deltaproteobacteria",1,6517073,6517073,0,1592,
1620,"Geobacter","sp.","FRC-32","Geobacter sp. FRC-32 chromosome I, NC_011979","Deltaproteobacteria","Deltaproteobacteria",1,4304501,4304501,0,1635,
1299,"Geobacter","lovleyi","SZ","Geobacter lovleyi SZ chromosome I, NC_010814","Deltaproteobacteria","Deltaproteobacteria",1,3917761,3917761,0,1321,
652,"Pelobacter","carbinolicus","DSM2380","Pelobacter carbinolicus DSM2380 chromosome I, NC_007498","Deltaproteobacteria","Deltaproteobacteria",1,3662252,3662252,0,652,
464,"Lawsonia","intracellularis","PHE-MN1-00","Lawsonia intracellularis PHE-MN1-00 chromosome I, NC_008011","Deltaproteobacteria","Deltaproteobacteria",1,1457619,1457619,0,464,
1559,"Anaeromyxobacter","dehalogenans","2CP-1","Anaeromyxobacter dehalogenans 2CP-1 chromosome I, NC_011891","Deltaproteobacteria","Deltaproteobacteria",1,5029329,5029329,0,1574,
45,"Anaeromyxobacter","sp.","Fw109-5","Anaeromyxobacter sp. Fw109-5 chromosome I, NC_009675","Deltaproteobacteria","Deltaproteobacteria",1,5277990,5277990,0,45,
965,"Syntrophus","aciditrophicus","SB","Syntrophus aciditrophicus SB chromosome I, NC_007759","Deltaproteobacteria","Deltaproteobacteria",1,3179300,3179300,0,965,
383,"Geobacter","sulfurreducens","PCA","Geobacter sulfurreducens PCA chromosome I, NC_002939","Deltaproteobacteria","Deltaproteobacteria",1,3814139,3814139,0,383,
653,"Pelobacter","propionicus","DSM2379","Pelobacter propionicus DSM2379 chromosome I, NC_008609","Deltaproteobacteria","Deltaproteobacteria",1,4008000,4008000,0,653,
1470,"Geobacter","bemidjiensis","Bem","Geobacter bemidjiensis Bem chromosome I, NC_011146","Deltaproteobacteria","Deltaproteobacteria",1,4615150,4615150,0,1485,
963,"Syntrophobacter","fumaroxidans","MPOB","Syntrophobacter fumaroxidans MPOB chromosome I, NC_008554","Deltaproteobacteria","Deltaproteobacteria",1,4990251,4990251,0,963,
2506,"Desulfobacterium","autotrophicum","HRM2","Desulfobacterium autotrophicum HRM2 chromosome I, NC_012108","Deltaproteobacteria","Deltaproteobacteria",1,5589073,5589073,0,2521,
308,"Desulfovibrio","desulfuricans","G20","Desulfovibrio desulfuricans G20 chromosome I, NC_007519","Deltaproteobacteria","Deltaproteobacteria",1,3730232,3730232,0,308,
104,"Bdellovibrio","bacteriovorus","HD100","Bdellovibrio bacteriovorus HD100 chromosome I, NC_005363","Deltaproteobacteria","Deltaproteobacteria",1,3782950,3782950,0,104,
309,"Desulfovibrio","vulgaris","Hildenborough","Desulfovibrio vulgaris Hildenborough chromosome I, NC_002937","Deltaproteobacteria","Deltaproteobacteria",1,3570858,3570858,0,309,
310,"Desulfovibrio","vulgaris","subsp. vulgaris DP4","Desulfovibrio vulgaris subsp. vulgaris DP4 chromosome I, NC_008751","Deltaproteobacteria","Deltaproteobacteria",1,3462887,3462887,0,310,
595,"Myxococcus","xanthus","DK 1622","Myxococcus xanthus DK 1622 chromosome I, NC_008095","Deltaproteobacteria","Deltaproteobacteria",1,9139763,9139763,0,595,
381,"Geobacter","metallireducens","GS-15","Geobacter metallireducens GS-15 chromosome I, NC_007517","Deltaproteobacteria","Deltaproteobacteria",1,3997420,3997420,0,381,
304,"Desulfotalea","psychrophila","LSv54","Desulfotalea psychrophila LSv54 chromosome I, NC_006138","Deltaproteobacteria","Deltaproteobacteria",1,3523383,3523383,0,304,
1434,"Desulfococcus","oleovorans","Hxd3","Desulfococcus oleovorans Hxd3 chromosome I, NC_009943","Deltaproteobacteria","Deltaproteobacteria",1,2046229,2046229,0,1449,
384,"Geobacter","uraniumreducens","Rf4","Geobacter uraniumreducens Rf4 chromosome I, NC_009483","Deltaproteobacteria","Deltaproteobacteria",1,5136364,5136364,0,384,
1469,"Anaeromyxobacter","sp.","K","Anaeromyxobacter sp. K chromosome I, NC_011145","Deltaproteobacteria","Deltaproteobacteria",1,5061632,5061632,0,1484,
44,"Anaeromyxobacter","dehalogenans","2CP-C","Anaeromyxobacter dehalogenans 2CP-C chromosome I, NC_007760","Deltaproteobacteria","Deltaproteobacteria",1,5013479,5013479,0,44,
1579,"Desulfovibrio","desulfuricans","subsp. desulfuricans ATCC 27774","Desulfovibrio desulfuricans subsp. desulfuricans ATCC 27774 chromosome I, NC_011883","Deltaproteobacteria","Deltaproteobacteria",1,2873437,2873437,0,1594,
2512,"Nautilia","profundicola","AmH","Nautilia profundicola AmH chromosome I, NC_012115","Epsilonproteobacteria","Epsilonproteobacteria",1,1676444,1676444,0,2527,
1514,"Helicobacter","pylori","G27","Helicobacter pylori G27 chromosome I, NC_011333","Epsilonproteobacteria","Epsilonproteobacteria",1,1652982,1652982,0,1529,
416,"Helicobacter","acinonychis","Sheeba","Helicobacter acinonychis Sheeba chromosome I, NC_008229","Epsilonproteobacteria","Epsilonproteobacteria",1,1553927,1553927,0,416,
417,"Helicobacter","hepaticus","ATCC5144","Helicobacter hepaticus ATCC5144 chromosome I, NC_004917","Epsilonproteobacteria","Epsilonproteobacteria",1,1799146,1799146,0,417,
216,"Campylobacter","curvus",525.92,"Campylobacter curvus 525.92 chromosome I, NC_009715","Epsilonproteobacteria","Epsilonproteobacteria",1,1971264,1971264,0,216,
418,"Helicobacter","pylori",26695,"Helicobacter pylori 26695 chromosome I, NC_000915","Epsilonproteobacteria","Epsilonproteobacteria",1,1667867,1667867,0,418,
2504,"Campylobacter","lari","RM2100","Campylobacter lari RM2100 chromosome I, NC_012039","Epsilonproteobacteria","Epsilonproteobacteria",1,1525460,1525460,0,2519,
219,"Campylobacter","jejuni","NCTC11168","Campylobacter jejuni NCTC11168 chromosome I, NC_002163","Epsilonproteobacteria","Epsilonproteobacteria",1,1641481,1641481,0,219,
421,"Helicobacter","pylori","J99","Helicobacter pylori J99 chromosome I, NC_000921","Epsilonproteobacteria","Epsilonproteobacteria",1,1643831,1643831,0,421,
946,"Sulfurovum","sp.","NBC37-1","Sulfurovum sp. NBC37-1 chromosome I, NC_009663","Epsilonproteobacteria","Epsilonproteobacteria",1,2562277,2562277,0,946,
222,"Campylobacter","jejuni","subsp. jejuni 81-176","Campylobacter jejuni subsp. jejuni 81-176 chromosome I, NC_008787","Epsilonproteobacteria","Epsilonproteobacteria",1,1616554,1616554,0,222,
221,"Campylobacter","jejuni","subsp. doylei 269.97","Campylobacter jejuni subsp. doylei 269.97 chromosome I, NC_009707","Epsilonproteobacteria","Epsilonproteobacteria",1,1845106,1845106,0,221,
606,"Nitratiruptor","sp.","SB155-2","Nitratiruptor sp. SB155-2 chromosome I, NC_009662","Epsilonproteobacteria","Epsilonproteobacteria",1,1877931,1877931,0,606,
419,"Helicobacter","pylori","HPAG1","Helicobacter pylori HPAG1 chromosome I, NC_008086","Epsilonproteobacteria","Epsilonproteobacteria",1,1596366,1596366,0,419,
1430,"Campylobacter","jejuni","subsp. jejuni 81116","Campylobacter jejuni subsp. jejuni 81116 chromosome I, NC_009839","Epsilonproteobacteria","Epsilonproteobacteria",1,212197,212197,0,1445,
1391,"Helicobacter","pylori","Shi470","Helicobacter pylori Shi470 chromosome I, NC_010698","Epsilonproteobacteria","Epsilonproteobacteria",1,1608547,1608547,0,1406,
218,"Campylobacter","hominis","ATCC BAA-381","Campylobacter hominis ATCC BAA-381 chromosome I, NC_009714","Epsilonproteobacteria","Epsilonproteobacteria",1,1711273,1711273,0,218,
1017,"Wolinella","succinogenes","DSM1740","Wolinella succinogenes DSM1740 chromosome I, NC_005090","Epsilonproteobacteria","Epsilonproteobacteria",1,2110355,2110355,0,1017,
986,"Sulfurimonas","denitrificans","DSM1251","Sulfurimonas denitrificans DSM1251 chromosome I, NC_007575","Epsilonproteobacteria","Epsilonproteobacteria",1,2201561,2201561,0,986,
51,"Arcobacter","butzleri","RM4018","Arcobacter butzleri RM4018 chromosome I, NC_009850","Epsilonproteobacteria","Epsilonproteobacteria",1,2341251,2341251,0,51,
220,"Campylobacter","jejuni","RM1221","Campylobacter jejuni RM1221 chromosome I, NC_003912","Epsilonproteobacteria","Epsilonproteobacteria",1,1777831,1777831,0,220,
1427,"Campylobacter","concisus",13826,"Campylobacter concisus 13826 chromosome I, NC_009802","Epsilonproteobacteria","Epsilonproteobacteria",1,2052007,2052007,0,1442,
217,"Campylobacter","fetus","subsp. fetus 82-40","Campylobacter fetus subsp. fetus 82-40 chromosome I, NC_008599","Epsilonproteobacteria","Epsilonproteobacteria",1,1773615,1773615,0,217,
1534,"Helicobacter","pylori","P12","Helicobacter pylori P12 chromosome I, NC_011498","Epsilonproteobacteria","Epsilonproteobacteria",1,1673813,1673813,0,1549,
515,"Methanococcus","maripaludis","C5","Methanococcus maripaludis C5 chromosome I, NC_009135","Euryarchaeota","Euryarchaeota",1,1780761,1780761,0,515,
529,"Methanosphaera","stadtmanae","DSM 3091","Methanosphaera stadtmanae DSM 3091 chromosome I, NC_007681","Euryarchaeota","Euryarchaeota",1,1767403,1767403,0,529,
521,"Methanoculleus","marisnigri","JR1","Methanoculleus marisnigri JR1 chromosome I, NC_009051","Euryarchaeota","Euryarchaeota",1,2478101,2478101,0,521,
519,"Methanococcus","vannielii","SB","Methanococcus vannielii SB chromosome I, NC_009634","Euryarchaeota","Euryarchaeota",1,1720048,1720048,0,519,
517,"Methanococcus","maripaludis","C7","Methanococcus maripaludis C7 chromosome I, NC_009637","Euryarchaeota","Euryarchaeota",1,1772694,1772694,0,517,
665,"Picrophilus","torridus","DSM9790","Picrophilus torridus DSM9790 chromosome I, NC_005877","Euryarchaeota","Euryarchaeota",1,1545895,1545895,0,665,
530,"Methanospirillum","hungatei","JF-1","Methanospirillum hungatei JF-1 chromosome I, NC_007796","Euryarchaeota","Euryarchaeota",1,3544738,3544738,0,530,
525,"Methanosarcina","acetivorans","C2A","Methanosarcina acetivorans C2A chromosome I, NC_003552","Euryarchaeota","Euryarchaeota",1,5751492,5751492,0,525,
524,"Methanosaeta","thermophila","PT (Methanothrix_thermophila_PT)","Methanosaeta thermophila PT (Methanothrix_thermophila_PT) chromosome I, NC_008553","Euryarchaeota","Euryarchaeota",1,1879471,1879471,0,524,
523,"Methanoregula","boonei","6A8","Methanoregula boonei 6A8 chromosome I, NC_009712","Euryarchaeota","Euryarchaeota",1,2542943,2542943,0,523,
514,"Methanococcus","aeolicus","Nankai-3","Methanococcus aeolicus Nankai-3 chromosome I, NC_009635","Euryarchaeota","Euryarchaeota",1,1569500,1569500,0,514,
1536,"Thermococcus","onnurineus","NA1","Thermococcus onnurineus NA1 chromosome I, NC_011529","Euryarchaeota","Euryarchaeota",1,1847607,1847607,0,1551,
734,"Pyrococcus","horikoshii","OT3","Pyrococcus horikoshii OT3 chromosome I, NC_000961","Euryarchaeota","Euryarchaeota",1,1738505,1738505,0,734,
972,"Thermoplasma","volcanium","GSS1","Thermoplasma volcanium GSS1 chromosome I, NC_002689","Euryarchaeota","Euryarchaeota",1,1584804,1584804,0,972,
513,"Methanococcoides","burtonii","DSM 6242","Methanococcoides burtonii DSM 6242 chromosome I, NC_007955","Euryarchaeota","Euryarchaeota",1,2575032,2575032,0,513,
509,"Methanobrevibacter","smithii","ATCC 35061","Methanobrevibacter smithii ATCC 35061 chromosome I, NC_009515","Euryarchaeota","Euryarchaeota",1,1853160,1853160,0,509,
600,"Natronomonas","pharaonis","DSM2160","Natronomonas pharaonis DSM2160 chromosome I, NC_007426","Euryarchaeota","Euryarchaeota",1,2595221,2595221,0,600,
971,"Thermoplasma","acidophilum","DSM1728","Thermoplasma acidophilum DSM1728 chromosome I, NC_002578","Euryarchaeota","Euryarchaeota",1,1564906,1564906,0,971,
512,"Methanocaldococcus","jannaschii","DSM2661","Methanocaldococcus jannaschii DSM2661 chromosome I, NC_000909","Euryarchaeota","Euryarchaeota",1,1664970,1664970,0,512,
1301,"Halobacterium","salinarum","R1","Halobacterium salinarum R1 chromosome I, NC_010364","Euryarchaeota","Euryarchaeota",1,1269543,1269543,0,1323,
409,"Halobacterium","sp","NRC-1","Halobacterium sp NRC-1 chromosome I, NC_002607","Euryarchaeota","Euryarchaeota",1,2014239,2014239,0,409,
518,"Methanococcus","maripaludis","S2","Methanococcus maripaludis S2 chromosome I, NC_005791","Euryarchaeota","Euryarchaeota",1,1661137,1661137,0,518,
412,"Haloquadratum","walsbyi","DSM 16790","Haloquadratum walsbyi DSM 16790 chromosome I, NC_008212","Euryarchaeota","Euryarchaeota",1,3132494,3132494,0,412,
1566,"Methanosphaerula","palustris","E1-9c","Methanosphaerula palustris E1-9c chromosome I, NC_011832","Euryarchaeota","Euryarchaeota",1,2922917,2922917,0,1581,
1473,"Methanosarcina","mazei","Go1","Methanosarcina mazei Go1 chromosome I, NC_003901","Euryarchaeota","Euryarchaeota",1,4096345,4096345,0,1488,
732,"Pyrococcus","abyssi","GE5","Pyrococcus abyssi GE5 chromosome I, NC_000868","Euryarchaeota","Euryarchaeota",1,1765118,1765118,0,732,
50,"Archaeoglobus","fulgidus","DSM4304","Archaeoglobus fulgidus DSM4304 chromosome I, NC_000917","Euryarchaeota","Euryarchaeota",1,2178400,2178400,0,50,
1188,"Methanococcus","maripaludis","C6","Methanococcus maripaludis C6 chromosome I, NC_009975","Euryarchaeota","Euryarchaeota",1,1744193,1744193,0,1220,
733,"Pyrococcus","furiosus","DSM3638","Pyrococcus furiosus DSM3638 chromosome I, NC_003413","Euryarchaeota","Euryarchaeota",1,1908256,1908256,0,733,
400,"Haloarcula","marismortui","ATCC 43049","Haloarcula marismortui ATCC 43049 chromosome I, NC_006396","Euryarchaeota","Euryarchaeota",1,3131724,3131724,0,400,
520,"Methanocorpusculum","labreanum","Z","Methanocorpusculum labreanum Z chromosome I, NC_008942","Euryarchaeota","Euryarchaeota",1,1804962,1804962,0,520,
526,"Methanosarcina","barkeri","Fusaro","Methanosarcina barkeri Fusaro chromosome I, NC_007355","Euryarchaeota","Euryarchaeota",1,4837408,4837408,0,526,
968,"Thermococcus","kodakarensis","KOD1","Thermococcus kodakarensis KOD1 chromosome I, NC_006624","Euryarchaeota","Euryarchaeota",1,2088737,2088737,0,968,
2508,"Halorubrum","lacusprofundi","ATCC 49239","Halorubrum lacusprofundi ATCC 49239 chromosome I, NC_012029","Euryarchaeota","Euryarchaeota",1,2735295,2735295,0,2523,
531,"Methanothermobacter","thermautotrophicus","Delta H","Methanothermobacter thermautotrophicus Delta H chromosome I, NC_000916","Euryarchaeota","Euryarchaeota",1,1751377,1751377,0,531,
522,"Methanopyrus","kandleri","AV19","Methanopyrus kandleri AV19 chromosome I, NC_003551","Euryarchaeota","Euryarchaeota",1,1694969,1694969,0,522,
2509,"Halorubrum","lacusprofundi","ATCC 49239","Halorubrum lacusprofundi ATCC 49239 chromosome II, NC_012028","Euryarchaeota","Euryarchaeota",1,525943,525943,0,2524,
591,"Mycoplasma","penetrans","HF-2","Mycoplasma penetrans HF-2 chromosome I, NC_004432","Firmicutes","Firmicutes",1,1358633,1358633,0,591,
257,"Clostridium","botulinum","A ATCC19397","Clostridium botulinum A ATCC19397 chromosome I, NC_009697","Firmicutes","Firmicutes",1,3863450,3863450,0,257,
923,"Streptococcus","pyogenes","MGAS10750","Streptococcus pyogenes MGAS10750 chromosome I, NC_008024","Firmicutes","Firmicutes",1,1937111,1937111,0,923,
966,"Thermoanaerobacter","tengcongensis","MB4T","Thermoanaerobacter tengcongensis MB4T chromosome I, NC_003869","Firmicutes","Firmicutes",1,2689445,2689445,0,966,
592,"Mycoplasma","pneumoniae","M129","Mycoplasma pneumoniae M129 chromosome I, NC_000912","Firmicutes","Firmicutes",1,816394,816394,0,592,
256,"Clostridium","beijerinckii","NCIMB8052","Clostridium beijerinckii NCIMB8052 chromosome I, NC_009617","Firmicutes","Firmicutes",1,6000632,6000632,0,256,
83,"Bacillus","licheniformis","ATCC14580 (DSM13)","Bacillus licheniformis ATCC14580 (DSM13) chromosome I, NC_006322","Firmicutes","Firmicutes",1,4222645,4222645,0,83,
226,"Carboxydothermus","hydrogenoformans","Z-2901","Carboxydothermus hydrogenoformans Z-2901 chromosome I, NC_007503","Firmicutes","Firmicutes",1,2401520,2401520,0,226,
335,"Enterococcus","faecalis","V583","Enterococcus faecalis V583 chromosome I, NC_004668","Firmicutes","Firmicutes",1,3218031,3218031,0,335,
82,"Bacillus","halodurans","C-125","Bacillus halodurans C-125 chromosome I, NC_002570","Firmicutes","Firmicutes",1,4202353,4202353,0,82,
881,"Staphylococcus","aureus","MRSA252","Staphylococcus aureus MRSA252 chromosome I, NC_002952","Firmicutes","Firmicutes",1,2902619,2902619,0,881,
84,"Bacillus","licheniformis","ATCC14580","Bacillus licheniformis ATCC14580 chromosome I, NC_006270","Firmicutes","Firmicutes",1,4222336,4222336,0,84,
254,"Clostridium","acetobutylicum","ATCC824","Clostridium acetobutylicum ATCC824 chromosome I, NC_003030","Firmicutes","Firmicutes",1,3940880,3940880,0,254,
271,"Clostridium","perfringens","ATCC 13124","Clostridium perfringens ATCC 13124 chromosome I, NC_008261","Firmicutes","Firmicutes",1,3256683,3256683,0,271,
657,"Pelotomaculum","thermopropionicum","SI","Pelotomaculum thermopropionicum SI chromosome I, NC_009454","Firmicutes","Firmicutes",1,3025375,3025375,0,657,
1459,"Staphylococcus","aureus","subsp. aureus Mu3","Staphylococcus aureus subsp. aureus Mu3 chromosome I, NC_009782","Firmicutes","Firmicutes",1,2880168,2880168,0,1474,
1491,"Natranaerobius","thermophilus","JW-NM-WN-LF","Natranaerobius thermophilus JW-NM-WN-LF chromosome I, NC_010718","Firmicutes","Firmicutes",1,3165557,3165557,0,1506,
277,"Clostridium","tetani","E88","Clostridium tetani E88 chromosome I, NC_004557","Firmicutes","Firmicutes",1,2044514,2044514,0,277,
888,"Staphylococcus","aureus","subsp. aureus JH1","Staphylococcus aureus subsp. aureus JH1 chromosome I, NC_009632","Firmicutes","Firmicutes",1,2906507,2906507,0,888,
78,"Bacillus","cereus","E33L-ZK","Bacillus cereus E33L-ZK chromosome I, NC_006274","Firmicutes","Firmicutes",1,5300915,5300915,0,78,
272,"Clostridium","perfringens","SM101","Clostridium perfringens SM101 chromosome I, NC_008262","Firmicutes","Firmicutes",1,2897393,2897393,0,272,
1461,"Streptococcus","gordonii","Challis subCH1","Streptococcus gordonii Challis subCH1 chromosome I, NC_009785","Firmicutes","Firmicutes",1,2196662,2196662,0,1476,
2537,"Clostridium","botulinum","A2 Kyoto","Clostridium botulinum A2 Kyoto chromosome I, NC_012563","Firmicutes","Firmicutes",1,4155278,4155278,0,2552,
1266,"Desulforudis","audaxviator","MP104C","Desulforudis audaxviator MP104C chromosome, I$NC_010424.txt","Firmicutes","Firmicutes",1,2349476,2349476,0,1294,
1460,"Staphylococcus","aureus","subsp. aureus MW2","Staphylococcus aureus subsp. aureus MW2 chromosome I, NC_003923","Firmicutes","Firmicutes",1,2820462,2820462,0,1475,
72,"Bacillus","cereus","ATCC10987","Bacillus cereus ATCC10987 chromosome I, NC_003909","Firmicutes","Firmicutes",1,5224283,5224283,0,72,
641,"Oenococcus","oeni","PSU-1","Oenococcus oeni PSU-1 chromosome I, NC_008528","Firmicutes","Firmicutes",1,1780517,1780517,0,641,
585,"Mycoplasma","genitalium","G37","Mycoplasma genitalium G37 chromosome I, NC_000908","Firmicutes","Firmicutes",1,580076,580076,0,585,
584,"Mycoplasma","gallisepticum","R","Mycoplasma gallisepticum R chromosome I, NC_004829","Firmicutes","Firmicutes",1,996422,996422,0,584,
268,"Clostridium","novyi","NT","Clostridium novyi NT chromosome I, NC_008593","Firmicutes","Firmicutes",1,2547720,2547720,0,268,
589,"Mycoplasma","mobile","163K","Mycoplasma mobile 163K chromosome I, NC_006908","Firmicutes","Firmicutes",1,777079,777079,0,589,
588,"Mycoplasma","hyopneumoniae","J","Mycoplasma hyopneumoniae J chromosome I, NC_007295","Firmicutes","Firmicutes",1,897405,897405,0,588,
587,"Mycoplasma","hyopneumoniae",7448,"Mycoplasma hyopneumoniae 7448 chromosome I, NC_007332","Firmicutes","Firmicutes",1,920079,920079,0,587,
935,"Streptococcus","thermophilus","LMD-9","Streptococcus thermophilus LMD-9 chromosome I, NC_008532","Firmicutes","Firmicutes",1,1856368,1856368,0,935,
79,"Bacillus","cereus","subsp. cytotoxis NVH 391-98","Bacillus cereus subsp. cytotoxis NVH 391-98 chromosome I, NC_009674","Firmicutes","Firmicutes",1,4087024,4087024,0,79,
260,"Clostridium","botulinum","A Hall","Clostridium botulinum A Hall chromosome I, NC_009698","Firmicutes","Firmicutes",1,3760560,3760560,0,260,
69,"Bacillus","anthracis","Sterne","Bacillus anthracis Sterne chromosome I, NC_005945","Firmicutes","Firmicutes",1,5228663,5228663,0,69,
266,"Clostridium","kluyveri","DSM 555","Clostridium kluyveri DSM 555 chromosome I, NC_009706","Firmicutes","Firmicutes",1,3964618,3964618,0,266,
917,"Streptococcus","pneumoniae","R6","Streptococcus pneumoniae R6 chromosome I, NC_003098","Firmicutes","Firmicutes",1,2038615,2038615,0,917,
920,"Streptococcus","pyogenes","Manfredo","Streptococcus pyogenes Manfredo chromosome I, NC_009332","Firmicutes","Firmicutes",1,1841271,1841271,0,920,
1235,"Thermoanaerobacter","sp.","X514","Thermoanaerobacter sp. X514 chromosome I, NC_010320","Firmicutes","Firmicutes",1,2457259,2457259,0,1267,
915,"Streptococcus","mutans","UA159","Streptococcus mutans UA159 chromosome I, NC_004350","Firmicutes","Firmicutes",1,2030921,2030921,0,915,
916,"Streptococcus","pneumoniae","D39","Streptococcus pneumoniae D39 chromosome I, NC_008533","Firmicutes","Firmicutes",1,2046115,2046115,0,916,
